{
  "schema": "vpp.command.requested",
  "schema_version": 1,
  "command_id": "0198c8d7-c8dc-7ae2-a3a1-eef5c6eddb70",
  "idempotency_key": "schedule-42:v3:bess-001:2026-08-13T01:00Z:set-power",
  "tenant_id": "7fdc2ef7-3b7d-4a43-a37c-63cc4b36a941",
  "device_id": "bess-001",
  "schedule_id": "schedule-42",
  "schedule_version": 3,
  "action": "SET_POWER",
  "parameters": {
    "active_power_kw": 100.0,
    "duration_seconds": 900
  },
  "not_before": "2026-08-13T01:00:00.000Z",
  "expires_at": "2026-08-13T01:00:20.000Z",
  "safety_config_version": 12,
  "created_at": "2026-08-12T10:02:00.000Z"
}

